{
  "id": "terran_helmet",
  "name": "Terran Field Helmet [T]",
  "description": "Standard-issue Terran infantry helmet. Iron bowl reinforced with interior padding and a neck guard. Heavy, uncomfortable after six hours, and the single most effective piece of personal protection issued to Terran soldiers. The dent on the left side was there when you got it. Don't think about that.",
  "takeable": true,
  "consumable": false,
  "attributes": {
    "equip_stat": "defense",
    "equip_bonus": 3
  },
  "tags": [
    "armor",
    "helm",
    "terra"
  ]
}